{
  "pageMode": "materials",
  "municipality": "豊橋市",
  "prefecture": "愛知県",
  "schoolName": "東田小学校",
  "schoolType": "小学校",
  "slug": "school-040-es",
  "basePath": "/archive/toyohashi/school-040-es/",
  "canonical": "https://ptaorg.com/archive/toyohashi/school-040-es/",
  "ogImage": "/assets/og-image-popc-en.png",
  "summary": "豊橋市の開示資料・保存資料を学校別に整理した一次資料アーカイブです。",
  "description": "東田小学校のPTA関連一次資料を、保存されているファイル単位で整理した学校別アーカイブです。",
  "sourceSummary": "Google Driveの「豊橋市_学校別整理版」に保存された学校別整理資料を基礎にしています。元PDF・画像は公開可否確認後に順次掲載します。",
  "documents": [
    {
      "year": "R7",
      "category": "学校徴収金",
      "title": "(3)　R7学校が保護者に発出した学校徴収金の案内（小学校）.pdf",
      "source": "豊橋市開示資料・学校別整理版",
      "publicationStatus": "公開前確認中"
    },
    {
      "year": "R7",
      "category": "学校徴収金",
      "title": "(3)　R7学校が保護者に発出した学校徴収金の案内（小学校）-1.png",
      "source": "豊橋市開示資料・学校別整理版",
      "publicationStatus": "公開前確認中"
    },
    {
      "year": "R7",
      "category": "学校徴収金",
      "title": "(3)　R7学校が保護者に発出した学校徴収金の案内、引落承諾書、同意書等.pdf",
      "source": "豊橋市開示資料・学校別整理版",
      "publicationStatus": "公開前確認中"
    },
    {
      "year": "R7",
      "category": "学校徴収金",
      "title": "(3)　R7学校が保護者に発出した学校徴収金の案内、引落承諾書、同意書等-1.png",
      "source": "豊橋市開示資料・学校別整理版",
      "publicationStatus": "公開前確認中"
    },
    {
      "year": "R6",
      "category": "学校徴収金",
      "title": "(3)　R6学校が保護者に発出した学校徴収金の案内（小学校）.pdf",
      "source": "豊橋市開示資料・学校別整理版",
      "publicationStatus": "公開前確認中"
    },
    {
      "year": "R6",
      "category": "学校徴収金",
      "title": "(3)　R6学校が保護者に発出した学校徴収金の案内（小学校）-1.png",
      "source": "豊橋市開示資料・学校別整理版",
      "publicationStatus": "公開前確認中"
    },
    {
      "year": "R6",
      "category": "学校徴収金",
      "title": "(3)　R6学校が保護者に発出した学校徴収金の案内、引落承諾書、同意書等.pdf",
      "source": "豊橋市開示資料・学校別整理版",
      "publicationStatus": "公開前確認中"
    },
    {
      "year": "R6",
      "category": "学校徴収金",
      "title": "(3)　R6学校が保護者に発出した学校徴収金の案内、引落承諾書、同意書等-1.png",
      "source": "豊橋市開示資料・学校別整理版",
      "publicationStatus": "公開前確認中"
    },
    {
      "year": "R6",
      "category": "PTA活動",
      "title": "(3)　R6PTA活動説明書・活動事業案内（小学校）.pdf",
      "source": "豊橋市開示資料・学校別整理版",
      "publicationStatus": "公開前確認中"
    },
    {
      "year": "R6",
      "category": "PTA活動",
      "title": "(3)　R6PTA活動説明書・活動事業案内（小学校）-3.png",
      "source": "豊橋市開示資料・学校別整理版",
      "publicationStatus": "公開前確認中"
    },
    {
      "year": "R6",
      "category": "PTA活動",
      "title": "(3)　R6PTA活動説明書・活動事業案内（小学校）-2.png",
      "source": "豊橋市開示資料・学校別整理版",
      "publicationStatus": "公開前確認中"
    },
    {
      "year": "R6",
      "category": "PTA活動",
      "title": "(3)　R6PTA活動説明書・活動事業案内（小学校）-1.png",
      "source": "豊橋市開示資料・学校別整理版",
      "publicationStatus": "公開前確認中"
    },
    {
      "year": "R7",
      "category": "学校とPTAの関係",
      "title": "(3)(7)　R7PTAと学校との間の契約書、委任状、覚書　PTAとの間で活動分担や責任範囲を定めた業務委託契約書、協定書、覚書、または連携協定文書（小学校）.pdf",
      "source": "豊橋市開示資料・学校別整理版",
      "publicationStatus": "公開前確認中"
    },
    {
      "year": "R7",
      "category": "学校とPTAの関係",
      "title": "(3)(7)　R7PTAと学校との間の契約書、委任状、覚書　PTAとの間で活動分担や責任範囲を定めた業務委託契約書、協定書、覚書、または連携協定文書（小学校）-1.png",
      "source": "豊橋市開示資料・学校別整理版",
      "publicationStatus": "公開前確認中"
    },
    {
      "year": "R6",
      "category": "学校とPTAの関係",
      "title": "(3)(7)　R6PTAと学校との間の契約書、委任状、覚書　PTAとの間で活動分担や責任範囲を定めた業務委託契約書、協定書、覚書、または連携協定文書（小学校）.pdf",
      "source": "豊橋市開示資料・学校別整理版",
      "publicationStatus": "公開前確認中"
    },
    {
      "year": "R6",
      "category": "学校とPTAの関係",
      "title": "(3)(7)　R6PTAと学校との間の契約書、委任状、覚書　PTAとの間で活動分担や責任範囲を定めた業務委託契約書、協定書、覚書、または連携協定文書（小学校）-1.png",
      "source": "豊橋市開示資料・学校別整理版",
      "publicationStatus": "公開前確認中"
    },
    {
      "year": "",
      "category": "PTA入会",
      "title": "(2)-1　PTAの入会希望者が入会の意思を示すため、学校通じて配布・回収された入会申込書（小学校）.pdf",
      "source": "豊橋市開示資料・学校別整理版",
      "publicationStatus": "公開前確認中"
    },
    {
      "year": "",
      "category": "PTA入会",
      "title": "(2)-1　PTAの入会希望者が入会の意思を示すため、学校通じて配布・回収された入会申込書（小学校）-1.png",
      "source": "豊橋市開示資料・学校別整理版",
      "publicationStatus": "公開前確認中"
    },
    {
      "year": "R6",
      "category": "PTA入会",
      "title": "(1)　R6PTAが新入生保護者に対し、学校を通じて配布した入会案内・説明書.pdf",
      "source": "豊橋市開示資料・学校別整理版",
      "publicationStatus": "公開前確認中"
    },
    {
      "year": "R6",
      "category": "PTA入会",
      "title": "(1)　R6PTAが新入生保護者に対し、学校を通じて配布した入会案内・説明書-1.png",
      "source": "豊橋市開示資料・学校別整理版",
      "publicationStatus": "公開前確認中"
    },
    {
      "year": "R6",
      "category": "PTA入会",
      "title": "(1)-2　R6PTAが新入生保護者に対し、学校を通じて配布した入会案内書・説明書（小学校）.pdf",
      "source": "豊橋市開示資料・学校別整理版",
      "publicationStatus": "公開前確認中"
    },
    {
      "year": "R6",
      "category": "PTA入会",
      "title": "(1)-2　R6PTAが新入生保護者に対し、学校を通じて配布した入会案内書・説明書（小学校）-1.png",
      "source": "豊橋市開示資料・学校別整理版",
      "publicationStatus": "公開前確認中"
    }
  ],
  "lastReviewed": "2026-10-02",
  "nationalArchive": {
    "order": 1040,
    "group": "豊橋市・小学校"
  }
}
