{
  "pageMode": "materials",
  "municipality": "広島市",
  "prefecture": "広島県",
  "schoolName": "河内小学校",
  "schoolType": "小学校",
  "slug": "school-032-es",
  "basePath": "/archive/hiroshima/school-032-es/",
  "canonical": "https://ptaorg.com/archive/hiroshima/school-032-es/",
  "ogImage": "/assets/og-image-popc-en.png",
  "summary": "広島市の保存資料を学校別に整理した一次資料アーカイブです。",
  "description": "河内小学校のPTA関連一次資料を、保存されている資料単位で整理した学校別アーカイブです。",
  "sourceSummary": "Google Drive「全国資料」とローカル保存資料を学校名で統合し、重複を整理した索引を基礎にしています。元ファイルは公開可否確認後に順次掲載します。",
  "documents": [
    {
      "year": "",
      "category": "PDF原資料",
      "title": "河内小学校_01.pdf",
      "source": "ローカル保存資料／全国資料（Google Drive）",
      "publicationStatus": "公開前確認中"
    }
  ],
  "lastReviewed": "2026-10-02",
  "nationalArchive": {
    "order": 13032,
    "group": "広島市・小学校"
  }
}
