{
  "pageMode": "materials",
  "municipality": "豊橋市",
  "prefecture": "愛知県",
  "schoolName": "東陽中学校",
  "schoolType": "中学校",
  "slug": "school-037-jhs",
  "basePath": "/archive/toyohashi/school-037-jhs/",
  "canonical": "https://ptaorg.com/archive/toyohashi/school-037-jhs/",
  "ogImage": "/assets/og-image-popc-en.png",
  "summary": "豊橋市の開示資料・保存資料を学校別に整理した一次資料アーカイブです。",
  "description": "東陽中学校のPTA関連一次資料を、保存されているファイル単位で整理した学校別アーカイブです。",
  "sourceSummary": "Google Driveの「豊橋市_学校別整理版」に保存された学校別整理資料を基礎にしています。元PDF・画像は公開可否確認後に順次掲載します。",
  "documents": [
    {
      "year": "R7",
      "category": "学校徴収金",
      "title": "(3)　R7学校が保護者に発出した学校徴収金の案内（中学校）.pdf",
      "source": "豊橋市開示資料・学校別整理版",
      "publicationStatus": "公開前確認中"
    },
    {
      "year": "R7",
      "category": "学校徴収金",
      "title": "(3)　R7学校が保護者に発出した学校徴収金の案内（中学校）-4.png",
      "source": "豊橋市開示資料・学校別整理版",
      "publicationStatus": "公開前確認中"
    },
    {
      "year": "R7",
      "category": "学校徴収金",
      "title": "(3)　R7学校が保護者に発出した学校徴収金の案内（中学校）-3.png",
      "source": "豊橋市開示資料・学校別整理版",
      "publicationStatus": "公開前確認中"
    },
    {
      "year": "R7",
      "category": "学校徴収金",
      "title": "(3)　R7学校が保護者に発出した学校徴収金の案内（中学校）-2.png",
      "source": "豊橋市開示資料・学校別整理版",
      "publicationStatus": "公開前確認中"
    },
    {
      "year": "R7",
      "category": "学校徴収金",
      "title": "(3)　R7学校が保護者に発出した学校徴収金の案内（中学校）-1.png",
      "source": "豊橋市開示資料・学校別整理版",
      "publicationStatus": "公開前確認中"
    },
    {
      "year": "R6",
      "category": "学校徴収金",
      "title": "(3)　R6学校が保護者に発出した学校徴収金の案内（中学校）.pdf",
      "source": "豊橋市開示資料・学校別整理版",
      "publicationStatus": "公開前確認中"
    },
    {
      "year": "R6",
      "category": "学校徴収金",
      "title": "(3)　R6学校が保護者に発出した学校徴収金の案内（中学校）-4.png",
      "source": "豊橋市開示資料・学校別整理版",
      "publicationStatus": "公開前確認中"
    },
    {
      "year": "R6",
      "category": "学校徴収金",
      "title": "(3)　R6学校が保護者に発出した学校徴収金の案内（中学校）-3.png",
      "source": "豊橋市開示資料・学校別整理版",
      "publicationStatus": "公開前確認中"
    },
    {
      "year": "R6",
      "category": "学校徴収金",
      "title": "(3)　R6学校が保護者に発出した学校徴収金の案内（中学校）-2.png",
      "source": "豊橋市開示資料・学校別整理版",
      "publicationStatus": "公開前確認中"
    },
    {
      "year": "R6",
      "category": "学校徴収金",
      "title": "(3)　R6学校が保護者に発出した学校徴収金の案内（中学校）-1.png",
      "source": "豊橋市開示資料・学校別整理版",
      "publicationStatus": "公開前確認中"
    },
    {
      "year": "R6",
      "category": "PTA活動",
      "title": "(3)　R6PTA活動説明書・活動事業案内（中学校）.pdf",
      "source": "豊橋市開示資料・学校別整理版",
      "publicationStatus": "公開前確認中"
    },
    {
      "year": "R6",
      "category": "PTA活動",
      "title": "(3)　R6PTA活動説明書・活動事業案内（中学校）-3.png",
      "source": "豊橋市開示資料・学校別整理版",
      "publicationStatus": "公開前確認中"
    },
    {
      "year": "R6",
      "category": "PTA活動",
      "title": "(3)　R6PTA活動説明書・活動事業案内（中学校）-2.png",
      "source": "豊橋市開示資料・学校別整理版",
      "publicationStatus": "公開前確認中"
    },
    {
      "year": "R6",
      "category": "PTA活動",
      "title": "(3)　R6PTA活動説明書・活動事業案内（中学校）-1.png",
      "source": "豊橋市開示資料・学校別整理版",
      "publicationStatus": "公開前確認中"
    }
  ],
  "lastReviewed": "2026-10-02",
  "nationalArchive": {
    "order": 1037,
    "group": "豊橋市・中学校"
  }
}
