{
  "pageMode": "materials",
  "municipality": "豊橋市",
  "prefecture": "愛知県",
  "schoolName": "青陵中学校",
  "schoolType": "中学校",
  "slug": "school-007-jhs",
  "basePath": "/archive/toyohashi/school-007-jhs/",
  "canonical": "https://ptaorg.com/archive/toyohashi/school-007-jhs/",
  "ogImage": "/assets/og-image-popc-en.png",
  "summary": "豊橋市の開示資料・保存資料を学校別に整理した一次資料アーカイブです。",
  "description": "青陵中学校のPTA関連一次資料を、保存されているファイル単位で整理した学校別アーカイブです。",
  "sourceSummary": "Google Driveの「豊橋市_学校別整理版」に保存された学校別整理資料を基礎にしています。元PDF・画像は公開可否確認後に順次掲載します。",
  "documents": [
    {
      "year": "R7",
      "category": "学校徴収金",
      "title": "(3)　R7学校が保護者に発出した学校徴収金の案内（中学校）.pdf",
      "source": "豊橋市開示資料・学校別整理版",
      "publicationStatus": "公開前確認中"
    },
    {
      "year": "R7",
      "category": "学校徴収金",
      "title": "(3)　R7学校が保護者に発出した学校徴収金の案内（中学校）-1.png",
      "source": "豊橋市開示資料・学校別整理版",
      "publicationStatus": "公開前確認中"
    },
    {
      "year": "R6",
      "category": "学校徴収金",
      "title": "(3)　R6学校が保護者に発出した学校徴収金の案内（中学校）.pdf",
      "source": "豊橋市開示資料・学校別整理版",
      "publicationStatus": "公開前確認中"
    },
    {
      "year": "R6",
      "category": "学校徴収金",
      "title": "(3)　R6学校が保護者に発出した学校徴収金の案内（中学校）-1.png",
      "source": "豊橋市開示資料・学校別整理版",
      "publicationStatus": "公開前確認中"
    },
    {
      "year": "R7",
      "category": "学校とPTAの関係",
      "title": "(3)(7)　R7PTAと学校との間の契約書、委任状、覚書　PTAとの間で活動分担や責任範囲を定めた業務委託契約書、協定書、覚書、または連携協定文書（中学校）.pdf",
      "source": "豊橋市開示資料・学校別整理版",
      "publicationStatus": "公開前確認中"
    },
    {
      "year": "R7",
      "category": "学校とPTAの関係",
      "title": "(3)(7)　R7PTAと学校との間の契約書、委任状、覚書　PTAとの間で活動分担や責任範囲を定めた業務委託契約書、協定書、覚書、または連携協定文書（中学校）-1.png",
      "source": "豊橋市開示資料・学校別整理版",
      "publicationStatus": "公開前確認中"
    },
    {
      "year": "R6",
      "category": "学校とPTAの関係",
      "title": "(3)(7)　R6PTAと学校との間の契約書、委任状、覚書　PTAとの間で活動分担や責任範囲を定めた業務委託契約書、協定書、覚書、または連携協定文書（中学校）.pdf",
      "source": "豊橋市開示資料・学校別整理版",
      "publicationStatus": "公開前確認中"
    },
    {
      "year": "R6",
      "category": "学校とPTAの関係",
      "title": "(3)(7)　R6PTAと学校との間の契約書、委任状、覚書　PTAとの間で活動分担や責任範囲を定めた業務委託契約書、協定書、覚書、または連携協定文書（中学校）-1.png",
      "source": "豊橋市開示資料・学校別整理版",
      "publicationStatus": "公開前確認中"
    },
    {
      "year": "R6",
      "category": "PTA入会",
      "title": "(1)-2　R6PTAが新入生保護者に対し、学校を通じて配布した入会案内・説明書（中学校）.pdf",
      "source": "豊橋市開示資料・学校別整理版",
      "publicationStatus": "公開前確認中"
    },
    {
      "year": "R6",
      "category": "PTA入会",
      "title": "(1)-2　R6PTAが新入生保護者に対し、学校を通じて配布した入会案内・説明書（中学校）-1.png",
      "source": "豊橋市開示資料・学校別整理版",
      "publicationStatus": "公開前確認中"
    },
    {
      "year": "R7",
      "category": "PTA入会",
      "title": "(1)-1　R7PTAが新入生保護者に対し、学校を通じて配布した入会案内・説明書（中学校）.pdf",
      "source": "豊橋市開示資料・学校別整理版",
      "publicationStatus": "公開前確認中"
    },
    {
      "year": "R7",
      "category": "PTA入会",
      "title": "(1)-1　R7PTAが新入生保護者に対し、学校を通じて配布した入会案内・説明書（中学校）-1.png",
      "source": "豊橋市開示資料・学校別整理版",
      "publicationStatus": "公開前確認中"
    }
  ],
  "lastReviewed": "2026-10-02",
  "nationalArchive": {
    "order": 1007,
    "group": "豊橋市・中学校"
  }
}
