{
  "pageMode": "materials",
  "municipality": "相模原",
  "prefecture": "神奈川県",
  "schoolName": "谷口台小学校",
  "schoolType": "小学校",
  "slug": "school-094-es",
  "basePath": "/archive/sagamihara/school-094-es/",
  "canonical": "https://ptaorg.com/archive/sagamihara/school-094-es/",
  "ogImage": "/assets/og-image-popc-en.png",
  "summary": "相模原の保存資料を学校別に整理した一次資料アーカイブです。",
  "description": "谷口台小学校のPTA関連一次資料を、保存されている資料単位で整理した学校別アーカイブです。",
  "sourceSummary": "Google Drive「全国資料」とローカル保存資料を学校名で統合し、重複を整理した索引を基礎にしています。元ファイルは公開可否確認後に順次掲載します。",
  "documents": [
    {
      "year": "",
      "category": "PDF原資料",
      "title": "013谷口台小学校.pdf",
      "source": "ローカル保存資料／全国資料（Google Drive）",
      "publicationStatus": "公開前確認中"
    }
  ],
  "lastReviewed": "2026-10-02",
  "nationalArchive": {
    "order": 17094,
    "group": "相模原・小学校"
  }
}
