{
  "pageMode": "materials",
  "municipality": "枚方市",
  "prefecture": "大阪府",
  "schoolName": "樟葉南小学校",
  "schoolType": "小学校",
  "slug": "school-039-es",
  "basePath": "/archive/hirakata/school-039-es/",
  "canonical": "https://ptaorg.com/archive/hirakata/school-039-es/",
  "ogImage": "/assets/og-image-popc-en.png",
  "summary": "枚方市の保存資料を学校別に整理した一次資料アーカイブです。",
  "description": "樟葉南小学校のPTA関連一次資料を、保存されている資料単位で整理した学校別アーカイブです。",
  "sourceSummary": "Google Drive「全国資料」とローカル保存資料を学校名で統合し、重複を整理した索引を基礎にしています。元ファイルは公開可否確認後に順次掲載します。",
  "documents": [
    {
      "year": "",
      "category": "その他資料",
      "title": "26 樟葉南小",
      "source": "全国資料（Google Drive）",
      "publicationStatus": "公開前確認中"
    }
  ],
  "lastReviewed": "2026-10-02",
  "nationalArchive": {
    "order": 14039,
    "group": "枚方市・小学校"
  }
}
